{
  "schemaVersion": 1,
  "slug": "daily-notes",
  "name": "Daily Notes",
  "description": "Quick capture notes app used to prove the generated static app workflow",
  "route": "/daily-notes/",
  "apiBase": "/api/daily-notes/",
  "hasBackend": false,
  "hasDatabase": false,
  "database": "none",
  "pwa": true,
  "offline": true,
  "icon": "/daily-notes/app-icon-192.png",
  "themeColor": "#5f4bb6",
  "backgroundColor": "#f5f0ff",
  "version": 1
}
